{
  "fixture_version": "notation-fixture/v1",
  "id": "hidden-plays/multiple-completed-hidden-targets",
  "ruleset": "truco-2p-v1",
  "context": {
    "human_player": 0,
    "bot_player": 1
  },
  "notation": "hidden(round=0, player=hero) = As\nhidden(round=1, player=opp) = manilha & suit in {SPADES, CLUBS}",
  "expect_fragment": {
    "completed_hidden_plays": [
      {
        "round_index": 0,
        "player": 0,
        "weighted_cards": [
          {
            "weight": 1,
            "card": {
              "exact": {
                "rank": "A",
                "suit": "SPADES"
              }
            }
          }
        ]
      },
      {
        "round_index": 1,
        "player": 1,
        "weighted_cards": [
          {
            "weight": 1,
            "card": {
              "is_manilha": true,
              "allowed_suits": [
                "SPADES",
                "CLUBS"
              ]
            }
          }
        ]
      }
    ]
  }
}
