{
  "fixture_version": "notation-fixture/v1",
  "id": "hidden-plays/weighted-current-hidden-play",
  "ruleset": "truco-2p-v1",
  "context": {
    "human_player": 0,
    "bot_player": 1
  },
  "notation": "hidden(opp) = manilha@2 | As@1",
  "expect_fragment": {
    "hidden_plays": {
      "1": {
        "weighted_cards": [
          {
            "weight": 2,
            "card": {
              "is_manilha": true
            }
          },
          {
            "weight": 1,
            "card": {
              "exact": {
                "rank": "A",
                "suit": "SPADES"
              }
            }
          }
        ]
      }
    }
  }
}
